{
    "logging_level": "info",
    "witness_name": "dev.witness.example",
    "description": "Local-dev witness for smoke testing",
    "submission_prefix": "http://localhost:8787/",
    "monitoring_prefix": "http://localhost:8787/",
    "logs": {
        "example.com/log1": {
            "description": "Dev-only log. SPKI matches the keypair embedded in tests/tlog_witness.rs.",
            "log_public_keys": [
                "MCowBQYDK2VwAyEAzdnT3CQc3ag2fmKnO1ntodIm0wfsymDkK89IOrHKLWc="
            ]
        }
    }
}
